PMID,Title,Abstract,Journal,Authors,Publication Date,DOI,PMC ID,URL,References,Grants
39994324,An integrated CSPPC and BiLSTM framework for malicious URL detection.,"With the rapid development of the internet, phishing attacks have become more diverse, making phishing website detection a key focus in cybersecurity. While machine learning and deep learning have led to various phishing URL detection methods, many remain incomplete, limiting accuracy. This paper proposes CSPPC-BiLSTM, a malicious URL detection model based on BiLSTM (Bidirectional Long Short-Term Memory, BiLSTM). The model processes URL character sequences through an embedding layer and captures contextual information via BiLSTM. By integrating CBAM (Convolutional Block Attention Module, CBAM), it applies channel and spatial attention to highlight key features and transforms URL sequence features into a spatial matrix. The SPP (Spatial Pyramid Pooling, SPP) module enables multi-scale pooling. Finally, a fully connected layer fuses features, and dropout regularization enhances robustness. Compared to CharBiLSTM, CSPPC-BiLSTM significantly improves detection accuracy. Evaluated on two datasets, Grambedding (balanced) and Mendeley AK Singh 2020 phish (imbalanced)-and compared with six baselines, it demonstrates strong generalization and accuracy. Ablation experiments confirm the critical role of CBAM and SPP in boosting performance.",Scientific reports,"Zhou, Zhang, Bilal, Zhou, Fan, Pan, Xie, Peng",2025,10.1038/s41598-025-91148-z,PMC11850714,https://pubmed.ncbi.nlm.nih.gov/39994324,"Atrees, M., Ahmad, A. & Alghanim, F. Enhancing Detection of Malicious URLs Using Boosting and Lexical Features 31 (Intelligent Automation & Soft Computing, 2022). 3.

Vanhoenshoven, F. et al. Detecting malicious URLs using machine learning techniques. In 2016 IEEE Symposium Series on Computational Intelligence (SSCI). IEEE, 1–8 (2016).

Wei, W. et al. Accurate and fast URL phishing detector: A convolutional neural network approach. Comput. Netw.178, 107275 (2020).

Afzal, S. et al. Urldeepdetect: A deep learning approach for detecting malicious urls using semantic vector models. J. Netw. Syst. Manag.29, 1–27 (2021).

Wang, H. et al. Bidirectional LSTM malicious webpages detection algorithm based on convolutional neural network and independent recurrent neural network. Appl. Intell.49, 3016–3026 (2019).

Le, H. et al. URLNet: Learning a URL representation with deep learning for malicious URL detection. ArXiv Preprint (2018). arXiv:1802.03162.

Liang, Y. et al. Robust detection of malicious urls with self-paced wide & deep learning. IEEE Trans. Depend. Secur. Comput.19 (2), 717–730 (2021).

Wu, T. et al. Malicious url detection model based on bidirectional gated recurrent unit and attention mechanism. Appl. Sci.12 (23), 12367 (2022).

Nanda, M. & Goel, S. URL based phishing attack detection using BiLSTM-gated highway attention block convolutional neural network. Multimed. Tools Appl., 1–31. (2024).

Liu, R. et al. Malicious URL detection via pretrained Language model guided Multi-Level feature attention network. arXiv preprint arXiv:2311.12372 (2023).

Mahdaouy, A. E. et al. DomURLs_BERT: Pre-trained BERT-based model for malicious domains and URLs detection and classification. arXiv preprint arXiv:2409.09143 (2024).

Nowroozi, E., Mohammadi, M. & Conti, M. An adversarial attack analysis on malicious advertisement URL detection framework. IEEE Trans. Netw. Serv. Manag.20 (2), 1332–1344 (2022).

Zhu, E. et al. CCBLA: a lightweight phishing detection model based on CNN, BiLSTM, and attention mechanism. Cogn. Comput.15 (4), 1320–1333 (2023).

Tsai, Y. D. et al. Toward more generalized malicious url detection models. Proc. AAAI Conf. Artif. Intell. 38 (19), 21628–21636 (2024).

Jeeva, S. C. & Rajsingh, E. B. Intelligent phishing url detection using association rule mining. Hum.-Cent. Comput. Inform. Sci.6, 1–19 (2016).

Lee¹, O. V. et al. A malicious urls detection system using optimization and machine learning classifiers. Indones. J. Electr. Eng. Comput. Sci.17 (3), 1210–1214 (2020).

AlEroud, A. & Karabatis, G. Bypassing detection of URL-based phishing attacks using generative adversarial deep neural networks. In Proceedings of the Sixth International Workshop on Security and Privacy Analytics, 53–60 (2020).

Karajgar, M. D. et al. Comparison of machine learning models for identifying malicious URLs. In 2024 IEEE International Conference on Information Technology, Electronics and Intelligent Communication Systems (ICITEICS). IEEE, 1–5. (2024).

Ozcan, A. et al. A hybrid DNN–LSTM model for detecting phishing urls. Neural Comput. Appl., 1–17 (2023).

Remya, S. et al. An Effective Detection Approach for Phishing URL Using ResMLP (IEEE Access, 2024).

Islam, M. S. et al. WebGuardML: Safeguarding users with malicious URL detection using machine learning. In 2023 26th International Conference on Computer and Information Technology (ICCIT). IEEE, 1–6. (2023).

Mia, M., Derakhshan, D. & Pritom, M. M. A. Can features for phishing URL detection be trusted across diverse datasets? A case study with explainable AI. In Proceedings of the 11th International Conference on Networking, Systems, and Security. 137–145 (2024).

Kaushik, P. & Rathore, S. P. S. Deep learning multi-agent model for phishing cyber-attack detection. Int. J. Recent. Innov. Trends Comput. Commun. 11 (9s), 680–686 (2023).

Su, M. Y. & Su, K. L. BERT-Based approaches to identifying malicious urls. Sensors23 (20), 8499 (2023).

Geyik, B., Erensoy, K. & Kocyigit, E. Detection of phishing websites from urls by using classification techniques on WEKA. In 6th Int. Conf. Inventive Comput. Technol. (ICICT). IEEE (2021), 120–125 (2021).

Taofeek, A. O. Development of a novel approach to phishing detection using machine learning. ATBU J. Sci. Technol. Educ.12 (2), 336–351 (2024).

Schuster, M. & Paliwal, K. K. Bidirectional recurrent neural networks. IEEE Trans. Signal Process.45 (11), 2673–2681 (1997).

Hochreiter, S. et al. Long short-term memory. Neural Computation MIT-Press, Cbam: Convolutional block attention module. In Proceedings of the European Conference on Computer Vision (ECCV). 2018, 3–19. (1997).

Woo, S. et al. Cbam: Convolutional block attention module. In Proceedings of the European Conference on Computer Vision (ECCV). : 3–19 (2018).

Zhao, H. et al. Pyramid scene parsing network. In Proceedings of the IEEE Conference on Computer Vision and Pattern Recognition. 2881–2890 (2017).

Bozkir, A. S., Dalgic, F. C. & Aydos, M. GramBeddings: A new neural network for URL based identification of phishing web pages through n-gram embeddings. Comput. Secur.124, 102964 (2023).

Singh, A. K. Dataset of Malicious and Benign Webpages (Mendeley Data, 2020).",No grants available
39448673,Phishing URL detection with neural networks: an empirical study.,"Cybercriminals create phishing websites that mimic legitimate websites to get sensitive information from companies, individuals, or governments. Therefore, using state-of-the-art artificial intelligence and machine learning technologies to correctly classify phishing and legitimate URLs is imperative. We report the results of applying deterministic and probabilistic neural network models to URL classification. Key achievements of this work are: (1) The development of a unique approach based on probabilistic neural networks that improves classification accuracy. (2) We show for the first time in URL phishing research that a machine learning model trained on a combination of open source and private datasets is successful in production. The dataset is constructed from open sources like Alexa, PhishTank, or OpenPhish and, most importantly, real-world production data from EasyDMARC. The daily validation of the model using daily reported URL data and corresponding labels, both from open-source platforms and private production, reach on average a 97% accuracy on the validation dataset, labeled by PhishTank, OpenPhish and EasdDMARC where possible mislabeled data can not be excluded and was not possible to check due to large number of URLs. Feature engineering was done without third-party dependencies. Lastly, the evaluation of both deterministic and probabilistic models shows high accuracy on short and long URLs, where short URLs are defined as having less than 50 characters.",Scientific reports,"Ghalechyan, Israyelyan, Arakelyan, Hovhannisyan, Davtyan",2024,10.1038/s41598-024-74725-6,PMC11502860,https://pubmed.ncbi.nlm.nih.gov/39448673,"Phishing activity trends report: 1st quarter 2022 (Anti-Phishing Working Group, 2022). http://docs.apwg.org/reports/apwg_trends_report_q1_2022.pdf. Accessed: 2022-08-17.

Phishing activity trends report: 1st quarter 2012 (Anti-Phishing Working Group, 2022). http://docs.apwg.org/reports/apwg_trends_report_q1_2012.pdf. Accessed: 2022-08-17.

Phishing Landscape . https://interisle.net/PhishingLandscape2022.pdf. Accessed: 2022-08-28 (2022)

Phishing activity trends report, 1st quarter . https://docs.apwg.org/reports/apwg_trends_report_q1_2021.pdf. Accessed: 2022-08-28. (2021)

Carroll, F., Adejobi, J. A. & Montasari, R. How good are we at detecting a phishing attack? Investigating the evolving phishing attack email and why it continues to successfully deceive society. SN Comput. Sci.3, 1–10 (2022).

X-Force threat intelligence index . https://www.ibm.com/downloads/cas/ADLMYLAZ. Accessed: 2022-08-28. (2022)

Franken-phish: TodayZoo built from other phishing kits. https://www.microsoft.com/en-us/security/blog/2021/10/21/franken-phish-todayzoo-built-from-other-phishing-kits/. Accessed: 2022-08-28.

State of IoT 2022: Number of connected IoT devices growing 18% to 14.4 billion globally. https://iot-analytics.com/number-connected-iot-devices/. Accessed: 2022-08-28.

Abbas, S. G. et al. Identifying and mitigating phishing attack threats in IoT use cases using a threat modelling approach. Sensors 21, 4816 (2021).

Nirmal, K., Janet, B. & Kumar, R. Analyzing and eliminating phishing threats in IoT, network and other web applications using iterative intersection. Peer-to-Peer Netw. Appl. 14, 2327 (2021).

Sheng, S. et al. An empirical analysis of phishing blacklists. InProceedings of 6th Conference on Email and AntiSpam (CEAS 2009) (2009).

Chou, N., Ledesma, R., Teraguchi, Y. & Mitchell, J. C. Client-side defense against web-based identity theft (2004).

Prakash, P., Kumar, M., Kompella, R. & Gupta, M. PhishNet: Predictive blacklisting to detect phishing attacks 1–5. 10.1109/INFCOM.2010.5462216 (2010).

Drury, V., Lux, L. & Meyer, U. Dating phish: An analysis of the life cycles of phishing attacks and campaigns. In Proceedings of the 17th International Conference on Availability, Reliability and Security, ARES ’22 (Association for Computing Machinery, 2022). 10.1145/3538969.3538997.

Rao, R. & Pais, A. An Enhanced Blacklist Method to Detect Phishing Websites 323–333 (2017).

Chu, W., Zhu, B. B., Xue, F., Guan, X. & Cai, Z. Protect sensitive sites from phishing attacks using features extractable from inaccessible phishing URLs. In 2013 IEEE International Conference on Communications (ICC) 1990–1994. 10.1109/ICC.2013.6654816 (2013).

Opara, C., Chen, Y. & Wei, B. Look before you leap: Detecting phishing web pages by exploiting raw URL and HTML characteristics. 10.48550/ARXIV.2011.04412 (2020).

Who is lookup. https://whois.domaintools.com/. Accessed: 2022-08-28.

Page, L., Brin, S., Motwani, R. & Winograd, T. The PageRank Citation Ranking: Bringing Order to the Web. Tech. Rep. (Stanford InfoLab, 1999).

7 ways to identify a phishing website. https://easydmarc.com/blog/7-ways-to-identify-a-phishing-website/. Accessed: 2022-08-28.

Reuvid, J. The Secure Online Business Handbook: E-commerce, IT Functionality & Business Continuity (Gale virtual reference library, Kogan Page, 2005).

Dua, S. & Du, X. Data Mining and Machine Learning in Cybersecurity (CRC Press, 2016).

Thomas, T., Vijayaraghavan, A. & Emmanuel, S. Machine Learning Approaches in Cyber Security Analytics (Springer Nature Singapore, 2019).

Alazab, M. & Tang, M. Deep Learning Applications for Cyber Security. Advanced Sciences and Technologies for Security Applications (Springer International Publishing, 2019).

Gupta, B. & Sheng, Q. Machine Learning for Computer and Cyber Security: Principle, Algorithms, and Practices (Cyber Ecosystem and Security, CRC Press, 2019).

Montasari, R. & Jahankhani, H. Artificial Intelligence in Cyber Security: Impact and Implications: Security Challenges, Technical and Ethical Issues Advanced sciences and Technologies For Security Applications, Forensic Investigative Challenges (Springer International Publishing AG, 2021).

Chen, X., Susilo, W. & Bertino, E. Cyber Security Meets Machine Learning (Springer, 2021).

Abdul Samad, S. R. et al. Analysis of the performance impact of fine-tuned machine learning model for phishing url detection. Electronics 12, 1642 (2023).

Karim, A., Shahroz, M., Mustofa, K., Belhaouari, S. B. & Joga, S. R. K. Phishing detection system through hybrid machine learning based on url. IEEE Access 11, 36805–36822 (2023).

Mamun, M. S. I., Rathore, M. A., Lashkari, A. H., Stakhanova, N. & Ghorbani, A. A. Detecting malicious URLs using lexical analysis. In International Conference on Network and System Security 467–482 (Springer, 2016).

Purbay, M. & Kumar, D. Split behavior of supervised machine learning algorithms for phishing url detection. In Advances in VLSI, Communication, and Signal Processing (eds Harvey, D. et al.) 497–505 (Springer Singapore, 2021).

Shirazi, H., Bezawada, B. & Ray, I. “Kn0w Thy Doma1n Name” unbiased phishing detection using domain name based features. In Proceedings of the 23nd ACM on Symposium on Access Control Models and Technologies 69–75 (2018).

Lin, Y. et al. Phishpedia: a hybrid deep learning based approach to visually identify phishing webpages. In 30th USENIX Security Symposium (USENIX Security 21) 3793–3810 (2021).

Jain, A. K., Debnath, N. & Jain, A. K. APuML: An efficient approach to detect mobile phishing webpages using machine learning. Wireless Personal Communications 1–22 (2022).

Aljofey, A. et al. An effective detection approach for phishing websites using URL and HTML features. Sci. Rep. 12, 1–19 (2022).

Das Guptta, S., Shahriar, K. T., Alqahtani, H., Alsalman, D. & Sarker, I. H. Modeling hybrid feature-based phishing websites detection using machine learning techniques. Ann. Data Sci. 1–26 (2022).

EasyDMARC. https://easydmarc.com/. Accessed: 2022-08-28.

PhishTank. https://www.phishtank.com/. Cisco Talos Intelligence Group, Accessed: 2022-08-25.

OpenPhish. https://openphish.com/. Accessed: 2022-08-28.

Alexa dataset. http://s3-us-west-1.amazonaws.com/umbrella-static/top-1m.csv.zip. Accessed: 2022-08-28.

Wang, W., Zhang, F., Luo, X. & Zhang, S. PDRCNN: precise phishing detection with recurrent convolutional neural networks. Security and Communication Networks 2019 (2019).

Guo, B. et al. HinPhish: An effective phishing detection approach based on heterogeneous information networks. Appl. Sci. 11, 9733 (2021).

Dua, D. & Graff, C. UCI Machine Learning Repository (2017).

Ghodke, S. Alexa Top 1 Million Sites. https://www.kaggle.com/datasets/cheedcheed/top1m. Accessed: 2022-08-28.

Phish Report. https://phish.report/contacts/OpenPhish. Accessed: 2022-08-28.

Cisco Acquisitions. https://www.cisco.com/c/en/us/about/corporate-strategy-office/acquisitions.html. Accessed: 2022-08-28.

TALOS. https://talosintelligence.com/. Accessed: 2022-08-28.

Phishing URL check. https://easydmarc.com/tools/phishing-url. Accessed: 2022-08-28.

Blundell, C., Cornebise, J., Kavukcuoglu, K. & Wierstra, D. Weight uncertainty in neural network. In International Conference on Machine Learning 1613–1622 (PMLR, 2015).",No grants available
38820435,An ensemble classification method based on machine learning models for malicious Uniform Resource Locators (URL).,"Web applications are important for various online businesses and operations because of their platform stability and low operation cost. The increasing usage of Internet-of-Things (IoT) devices within a network has contributed to the rise of network intrusion issues due to malicious Uniform Resource Locators (URLs). Generally, malicious URLs are initiated to promote scams, attacks, and frauds which can lead to high-risk intrusion. Several methods have been developed to detect malicious URLs in previous works. There has been a good amount of work done to detect malicious URLs using various methods such as random forest, regression, LightGBM, and more as reported in the literature. However, most of the previous works focused on the binary classification of malicious URLs and are tested on limited URL datasets. Nevertheless, the detection of malicious URLs remains a challenging task that remains open to research. Hence, this work proposed a stacking-based ensemble classifier to perform multi-class classification of malicious URLs on larger URL datasets to justify the robustness of the proposed method. This study focuses on obtaining lexical features directly from the URL to identify malicious websites. Then, the proposed stacking-based ensemble classifier is developed by integrating Random Forest, XGBoost, LightGBM, and CatBoost. In addition, hyperparameter tuning was performed using the Randomized Search method to optimize the proposed classifier. The proposed stacking-based ensemble classifier aims to take advantage of the performance of each machine learning model and aggregate the output to improve prediction accuracy. The classification accuracies of the machine learning model when applied individually are 93.6%, 95.2%, 95.7% and 94.8% for random forest, XGBoost, LightGBM, and CatBoost respectively. The proposed stacking-based ensemble classifier has shown significant results in classifying four classes of malicious URLs (phishing, malware, defacement, and benign) with an average accuracy of 96.8% when benchmarked with previous works.",PloS one,"Sankaranarayanan, Sivachandran, Mohd Khairuddin, Hasikin, Wahab Sait",2024,10.1371/journal.pone.0302196,PMC11142511,https://pubmed.ncbi.nlm.nih.gov/38820435,"Liu Z, Jin Z, Shangguan C. IoT terminal security assessment system based on improved assessment method. PLoS ONE. 2021; 16(9). doi: 10.1371/journal.pone.0256881

Bahaa A, Sayed A, Elfangary L, Fahmy H. A novel hybrid optimization enabled robust CNN algorithm for an IoT network intrusion detection approach. PLoS ONE. 2022; 17(12) doi: 10.1371/journal.pone.0278493

Zhou J, Cui H, Li X, Yang W, Wu X. A novel phishing website detection model based on LightGBM and domain name features. Symmetry. 2023; 15(180). doi: 10.3390/sym15010180

Hilal M, Abdalla Hashim AH, Mohamed AH, Nour MK, Asiri MM, et al.. Malicious url classification using artificial fish swarm optimization and deep learning. Computers, Materials & Continua. 2023; 74(1):607–621.

Abu Al-Haija Q, Al-Fayoumi M: An intelligent identification and classification system for malicious uniform resource locators (URLs). Neural Comput & Applic. 2023; 35: 16995–17011. doi: 10.1007/s00521-023-08592-z

Djaballah KA, Boukhalfa K, Ghalem Z, Boukerma O. A new approach for the detection and analysis of phishing in social networks: the case of Twitter. In 2020 Seventh International Conference on Social Networks Analysis, Management and Security (SNAMS). 2020; 1–8.

Subasi A, Balfaqih M, Balfagih Z, Alfawwaz K. A comparative evaluation of ensemble classifiers for malicious webpage detection. Procedia Computer Science. 2021; 194: 272–279.

Johnson C, Khadka B, Basnet RB, Doleck T. Towards detecting and classifying malicious URLs using deep learning. J. Wirel. Mob. Networks Ubiquitous Comput. Dependable Appl. 2020; 11(4): 31–48.

Tie L, Gang K, Yi P. Improving malicious URLs detection via feature engineering: Linear and nonlinear space transformation methods. Information Systems. 2020; 91(101494).

Hasane Ahammad SK, Sunil DK, Gopal DU, Sandeep DP, Venkatesh Babu E, Amol VD, Dilip Kumar JB. Phishing URL detection using machine learning methods. Advances in Engineering Software. 2022; 173 (103288). doi: 10.1016/j.advengsoft.2022.103288

Chiramdasu R, Srivastava G, Bhattacharya S, Reddy PK, Gadekallu TR. Malicious URL detection using logistic regression, 2021 IEEE International Conference on Omni-Layer Intelligent Systems (COINS), Barcelona, Spain. 2021; 1–6. doi: 10.1109/COINS51742.2021.9524269

Hossain F, Islam L, Uddin MN. PhishRescue: A stacked ensemble model to identify phishing website using lexical features, 5th International Conference of Computer and Informatics Engineering (IC2IE). 2022; 342–347.

Indrasiri PL, Halgamuge MN, Mohammad A. Robust ensemble machine learning model for filtering phishing URLs: Expandable random gradient stacked voting classifier (ERG-SVC). IEEE Access. 2021; 9:150142–150161.

Bustio-Martínez L, Álvarez-Carmona MA, Herrera-Semenets V, Feregrino-Uribe C, Cumplido R. A lightweight data representation for phishing URLs detection in IoT environments. Information Sciences. 2022; 603: 42–59. doi: 10.1016/j.ins.2022.04.059

Nasir N, Kansal A, Alshaltone O, Barneih F, Sameer M, Shanableh A, et al.. Water quality classification using machine learning algorithms. Journal of Water Process Engineering. 2022; 48 (102920). doi: 10.1016/j.jwpe.2022.102920

Chen J, Hu Z, Qian Z. Research on malicious URL detection based on random forest. 14th International Conference on Computer Research and Development (ICCRD). 2022; 30–36.

Junos MH, Mohd Khairuddin AS, Dahari M. Automated object detection on aerial images for limited capacity embedded device using a lightweight CNN model. Alexandria Engineering Journal. 2022; 61 (8): 6023–6041. doi: 10.1016/j.aej.2021.11.027

Manzil HHR, Manohar Naik S. Android malware category detection using a novel feature vector-based machine learning model. Cybersecurity. 2023; 6 (6). doi: 10.1186/s42400-023-00139-y

Rupa CH, Srivastava G, Bhattacharya S, Reddy P, Gadekallu TR. A machine learning driven threat intelligence system for malicious URL detection. 16th International Conference on Availability, Reliability and Security. Vienna, Austria. 2021; 1–7. doi: 10.1145/3465481.3470029

Upendri SDR, Patil A, Mohana. Malicious URL Detection and Classification Analysis using Machine Learning Models. International Conference on Intelligent Data Communication Technologies and Internet of Things, Bengaluru, India. 2023; 470–476. doi: 10.1109/IDCIoT56793.2023.10053422",No grants available
