PMID,Title,Abstract,Journal,Authors,Publication Date,DOI,PMC ID,URL,References,Grants
35645443,Applications of deep learning for phishing detection: a systematic literature review.,"Phishing attacks aim to steal confidential information using sophisticated methods, techniques, and tools such as phishing through content injection, social engineering, online social networks, and mobile applications. To avoid and mitigate the risks of these attacks, several phishing detection approaches were developed, among which deep learning algorithms provided promising results. However, the results and the corresponding lessons learned are fragmented over many different studies and there is a lack of a systematic overview of the use of deep learning algorithms in phishing detection. Hence, we performed a systematic literature review (SLR) to identify, assess, and synthesize the results on deep learning approaches for phishing detection as reported by the selected scientific publications. We address nine research questions and provide an overview of how deep learning algorithms have been used for phishing detection from several aspects. In total, 43 journal articles were selected from electronic databases to derive the answers for the defined research questions. Our SLR study shows that except for one study, all the provided models applied supervised deep learning algorithms. The widely used data sources were URL-related data, third party information on the website, website content-related data, and email. The most used deep learning algorithms were deep neural networks (DNN), convolutional neural networks, and recurrent neural networks/long short-term memory networks. DNN and hybrid deep learning algorithms provided the best performance among other deep learning-based algorithms. 72% of the studies did not apply any feature selection algorithm to build the prediction model. PhishTank was the most used dataset among other datasets. While Keras and Tensorflow were the most preferred deep learning frameworks, 46% of the articles did not mention any framework. This study also highlights several challenges for phishing detection to pave the way for further research.",Knowledge and information systems,"Catal, Giray, Tekinerdogan, Kumar, Shukla",2022,10.1007/s10115-022-01672-x,PMC9125357,https://pubmed.ncbi.nlm.nih.gov/35645443,"Abed W, Sharma S, Sutton R, Motwani A. A robust bearing fault detection and diagnosis technique for brushless DC motors under non-stationary operating conditions. J Control Autom Electr Syst. 2015;26(3):241–254. doi: 10.1007/s40313-015-0173-7.

Adebowale MA, Lwin KT, Hossain MA. Intelligent phishing detection scheme using deep learning algorithms. J Enterp Inf Manag. 2020 doi: 10.1108/JEIM-01-2020-0036.

Ali NB, Petersen K (2014) Evaluating strategies for study selection in systematic literature studies. In: Proceedings of the 8th ACM/IEEE international symposium on empirical software engineering and measurement, pp 1–4

Aljofey A, Jiang Q, Qu Q, Huang M, Niyigena JP. An effective phishing detection model based on character level convolutional neural network from URL. Electronics. 2020;9(9):1514. doi: 10.3390/electronics9091514.

Almomani A. Fast-flux hunter: a system for filtering online fast-flux botnet. Neural Comput Appl. 2018;29(7):483–493. doi: 10.1007/s00521-016-2531-1.

Alom MZ, Taha TM (2017) Network intrusion detection for cyber security using unsupervised deep learning approaches. In: 2017 IEEE national aerospace and electronics conference (NAECON). IEEE, pp 63–69

Amershi S, Begel A, Bird C, DeLine R, Gall H, Kamar E, Zimmermann T (2019) Software engineering for machine learning: a case study. In: 2019 IEEE/ACM 41st international conference on software engineering: software engineering in practice (ICSE-SEIP). IEEE, pp 291–300

Amyar A, Modzelewski R, Li H, Ruan S. Multi-task deep learning based CT imaging analysis for COVID-19 pneumonia: Classification and segmentation. Comput Biol Med. 2020;126:104037. doi: 10.1016/j.compbiomed.2020.104037.

APWG GA, Manning R (2020) APWG Phishing Reports

Basili VR, Caldiera G, Rombach HD (1994) The goal question metric approach. Encyclopedia of software engineering, pp 528–532

Basit A, Zafar M, Liu X, Javed AR, Jalil Z, Kifayat K. A comprehensive survey of AI-enabled phishing attacks detection techniques. Telecommun Syst. 2020;76:139–154. doi: 10.1007/s11235-020-00733-2.

Benavides E, Fuertes W, Sanchez S, Sanchez M (2020) Classification of phishing attack solutions by employing deep learning techniques: a systematic literature review. In: Developments and advances in defense and security. Springer, Singapore, pp 51–64

Bengio Y, Lamblin P, Popovici D, Larochelle H. Greedy layer-wise training of deep networks. Adv Neural Inf Process Syst. 2006;19:153–160.

Berman DS, Buczak AL, Chavis JS, Corbett CL. A survey of deep learning methods for cyber security. Information. 2019;10(4):122. doi: 10.3390/info10040122.

Catal C (2012) On the application of genetic algorithms for test case prioritization: a systematic literature review. In: Proceedings of the 2nd international workshop on Evidential assessment of software technologies, pp 9–14

Catal C, Mishra D. Test case prioritization: a systematic mapping study. Software Qual J. 2013;21(3):445–478. doi: 10.1007/s11219-012-9181-z.

Da Silva CMR, Feitosa EL, Garcia VC. Heuristic-based strategy for Phishing prediction: a survey of URL-based approach. Comput Secur. 2020;88:101613. doi: 10.1016/j.cose.2019.101613.

Deng L. Three classes of deep learning architectures and their applications: a tutorial survey. APSIPA Trans Signal Inf Process. 2012;57:58.

Deng L, Yu D. Deep learning: methods and applications. Found Trends Signal Process. 2014;7(3–4):197–387. doi: 10.1561/2000000039.

Dou Z, Khalil I, Khreishah A, Al-Fuqaha A, Guizani M. Systematization of knowledge (SoK): a systematic review of software-based web phishing detection. IEEE Commun Surv Tutor. 2017;19(4):2797–2819. doi: 10.1109/COMST.2017.2752087.

El Aassal A, Baki S, Das A, Verma RM. An in-depth benchmarking and evaluation of phishing detection research for security needs. IEEE Access. 2020;8:22170–22192. doi: 10.1109/ACCESS.2020.2969780.

Emamgholizadeh S, Mohammadi B. New hybrid nature-based algorithm to integration support vector machine for prediction of soil cation exchange capacity. Soft Comput. 2021;25(21):13451–13464. doi: 10.1007/s00500-021-06095-4.

Feng J, Zou L, Nan T. A phishing webpage detection method based on stacked autoencoder and correlation coefficients. J Comput Inf Technol. 2019;27(2):41–54. doi: 10.20532/cit.2019.1004702.

Ferreira M (2019) Malicious URL detection using machine learning algorithms. In: Proc. Digit. Privacy Security Conf., pp 114–122

Fukushima K, Miyake S (1982) Neocognitron: a self-organizing neural network model for a mechanism of visual pattern recognition. In: Competition and cooperation in neural nets. Springer, Berlin, Heidelberg, pp 267–285

Gangavarapu T, Jaidhar CD, Chanduka B. Applicability of machine learning in spam and phishing email filtering: review and approaches. Artif Intell Rev. 2020;53:5019–5081. doi: 10.1007/s10462-020-09814-9.

Gardner MW, Dorling SR. Artificial neural networks (the multilayer perceptron)—a review of applications in the atmospheric sciences. Atmos Environ. 1998;32(14–15):2627–2636. doi: 10.1016/S1352-2310(97)00447-0.

Glorot X, Bengio Y (2010) Understanding the difficulty of training deep feedforward neural networks. In: Proceedings of the thirteenth international conference on artificial intelligence and statistics, pp 249–256

Goel D, Jain AK. Mobile phishing attacks and defence mechanisms: State of art and open research challenges. Comput Secur. 2018;73:519–544. doi: 10.1016/j.cose.2017.12.006.

Goodfellow I, Bengio Y, Courville A, Bengio Y. Deep learning. Cambridge: MIT Press; 2016.

Gowtham R, Krishnamurthi I. A comprehensive and efficacious architecture for detecting phishing webpages. Comput Secur. 2014;40:23–37. doi: 10.1016/j.cose.2013.10.004.

Greff K, Srivastava RK, Koutník J, Steunebrink BR, Schmidhuber J. LSTM: A search space odyssey. IEEE Trans Neural Netw Learn Syst. 2016;28(10):2222–2232. doi: 10.1109/TNNLS.2016.2582924.

Hannousse A, Yahiouche S. Towards benchmark datasets for machine learning based website phishing detection: an experimental study. Eng Appl Artif Intell. 2021;104:104347. doi: 10.1016/j.engappai.2021.104347.

Hassler E, Carver JC, Kraft NA, Hale D (2014) Outcomes of a community workshop to identify and rank barriers to the systematic literature review process. In: Proceedings of the 18th international conference on evaluation and assessment in software engineering, pp 1–10

Hochreiter S, Schmidhuber J. Long short-term memory. Neural Comput. 1997;9(8):1735–1780. doi: 10.1162/neco.1997.9.8.1735.

Hornik K, Stinchcombe M, White H. Multilayer feedforward networks are universal approximators. Neural Netw. 1989;2(5):359–366. doi: 10.1016/0893-6080(89)90020-8.

Hrasko R, Pacheco AG, Krohling RA. Time series prediction using restricted boltzmann machines and backpropagation. Procedia Comput Sci. 2015;55:990–999. doi: 10.1016/j.procs.2015.07.104.

Khonji M, Iraqi Y, Jones A. Phishing detection: a literature survey. IEEE Commun Surv Tutor. 2013;15(4):2091–2121. doi: 10.1109/SURV.2013.032213.00009.

Kiruthiga R, Akila D. Phishing websites detection using machine learning. Int J Recent Technol Eng. 2019;8(2):111–114.

Kitchenham B, Pearl Brereton O, Budgen D, Turner M, Bailey J, Linkman S. Systematic literature reviews in software engineering—a systematic literature review. Inf Softw Technol. 2009;51(1):7–15. doi: 10.1016/j.infsof.2008.09.009.

Kitchenham BA, Budgen D, Brereton P. Evidence-based software engineering and systematic reviews. Boca Raton: CRC Press; 2015.

Li Q, Cheng M, Wang J, Sun B. LSTM based 3 data. IEEE Trans Big Data. 2020;8(1):278–288. doi: 10.1109/TBDATA.2020.2978915.

Mahdavifar S, Ghorbani AA. Application of deep learning to cybersecurity: a survey. Neurocomputing. 2019;347:149–176. doi: 10.1016/j.neucom.2019.02.056.

Maurya S, Jain A. Deep learning to combat phishing. J Stat Manag Syst. 2020;23(6):945–957.

Miles MB, Huberman AM, Saldaña J. Qualitative data analysis: a methods sourcebook. 4. Thousand Oaks: SAGE Publications Inc; 2019.

Mohamed AR, Dahl G, Hinton G (2009) Deep belief networks for phone recognition. In: Nips workshop on deep learning for speech recognition and related applications, vol 1, no 9, p 39

Mohammadi B, Guan Y, Moazenzadeh R, Safari MJS. Implementation of hybrid particle swarm optimization-differential evolution algorithms coupled with multi-layer perceptron for suspended sediment load estimation. CATENA. 2021;198:105024. doi: 10.1016/j.catena.2020.105024.

Mohammed Harun Babu R, Vinayakumar R, Soman KP (2018) A short review on applications of deep learning for cyber security. arXiv preprint arXiv:1812.06292

Nagaraj K, Bhattacharjee B, Sridhar A, Sharvani G (2018) Detection of phishing websites using a novel twofold ensemble model. J Syst Inf Technol.

Pascanu R, Mikolov T, Bengio Y (2013) On the difficulty of training recurrent neural networks. In: International conference on machine learning, pp 1310–1318

Peng Y, Tian S, Yu L, Lv Y, Wang R. A joint approach to detect malicious URL based on attention mechanism. Int J Comput Intell Appl. 2019;18(03):1950021. doi: 10.1142/S1469026819500214.

Petersen K, Feldt R, Mujtaba S, Mattsson M (2008) Systematic mapping studies in software engineering. In: 12th international conference on evaluation and assessment in software engineering (EASE) 12, pp 1–10

Petersen K, Vakkalanka S, Kuzniarz L. Guidelines for conducting systematic mapping studies in software engineering: an update. Inf Softw Technol. 2015;64:1–18. doi: 10.1016/j.infsof.2015.03.007.

Qiu X, Zhang L, Ren Y, Suganthan PN, Amaratunga G (2014) Ensemble deep learning for regression and time series forecasting. In: 2014 IEEE symposium on computational intelligence in ensemble learning (CIEL). IEEE, pp 1–6

Ramzan Z, Wüest C (2007) Phishing attacks: analyzing trends in 2006. In: CEAS

Rao RS, Pais AR. Jail-Phish: an improved search engine based phishing detection system. Comput Secur. 2019;83:246–267. doi: 10.1016/j.cose.2019.02.011.

Ravi R. A performance analysis of software defined network based prevention on phishing attack in cyberspace using a deep machine learning with CANTINA approach (DMLCA) Comput Commun. 2020;153:375–381. doi: 10.1016/j.comcom.2019.11.047.

Sahoo D, Liu C, Hoi SC (2017) Malicious URL detection using machine learning: a survey. arXiv preprint arXiv:1701.07179

Seydoux L, Balestriero R, Poli P, De Hoop M, Campillo M, Baraniuk R. Clustering earthquake signals and background noises in continuous seismic data with unsupervised deep learning. Nat Commun. 2020;11(1):1–12. doi: 10.1038/s41467-020-17841-x.

Sharmeen S, Huda S, Abawajy J, Hassan MM. An adaptive framework against android privilege escalation threats using deep learning and semi-supervised approaches. Appl Soft Comput. 2020;89:106089. doi: 10.1016/j.asoc.2020.106089.

Shrivastava V, Damodaran SS, Kamble M. Adalward: a deep-learning framework for multi-class malicious webpage detection. J Cyber Secur Technol. 2020;4:153–195. doi: 10.1080/23742917.2020.1714195.

Singh C, Meenu (2020) Phishing website detection based on machine learning: a survey. In: 2020 6th international conference on advanced computing and communication systems (ICACCS). IEEE, pp 398–404

Somesha M, Pais AR, Rao RS, Rathour VS. Efficient deep learning techniques for the detection of phishing websites. Sādhanā. 2020;45(1):1–18. doi: 10.1007/s12046-020-01392-4.

Song L, Lin JP, Wang ZJ, Wang H. An end-to-end multi-task deep learning framework for skin lesion analysis. IEEE J Biomed Health Inform. 2020;24:2912–2921. doi: 10.1109/JBHI.2020.2973614.

Sullins LL. Phishing for a solution: Domestic and international approaches to decreasing online identity theft. Emory Int'l L Rev. 2006;20:397.

Sumathi K, Sujatha V. Deep learning based-phishing attack detection. Int J Recent Technol Eng (IJRTE) 2019;8(3):8428–8432. doi: 10.35940/ijrte.C6527.098319.

Tarhan A, Giray G (2017) On the use of ontologies in software process assessment: a systematic literature review. In Proceedings of the 21st international conference on evaluation and assessment in software engineering, pp 2–11

Torres-Soto J, Ashley EA. Multi-task deep learning for cardiac rhythm detection in wearable devices. NPJ Digital Med. 2020;3(1):1–8. doi: 10.1038/s41746-020-00320-4.

Tummers J, Kassahun A, Tekinerdogan B. Obstacles and features of farm management information systems: a systematic literature review. Comput Electron Agric. 2019;157:189–204. doi: 10.1016/j.compag.2018.12.044.

Varshney G, Misra M, Atrey PK. A survey and classification of web phishing detection schemes. Secur Commun Netw. 2016;9(18):6266–6284. doi: 10.1002/sec.1674.

Vayansky I, Kumar S. Phishing–challenges and solutions. Comput Fraud Secur. 2018;2018(1):15–20. doi: 10.1016/S1361-3723(18)30007-1.

Vinayakumar R, Soman KP, Poornachandran P. Evaluating deep learning approaches to characterize and classify malicious URL’s. J Intell Fuzzy Syst. 2018;34(3):1333–1343. doi: 10.3233/JIFS-169429.

Vrbančič G, Fister I, Jr, Podgorelec V. Datasets for phishing websites detection. Data Brief. 2020;33:106438. doi: 10.1016/j.dib.2020.106438.

Wang Y, Cai WD, Wei PC. A deep learning approach for detecting malicious JavaScript code. Secur Commun Netw. 2016;9(11):1520–1534. doi: 10.1002/sec.1441.

Wang HH, Yu L, Tian SW, Peng YF, Pei XJ. Bidirectional LSTM Malicious webpages detection algorithm based on convolutional neural network and independent recurrent neural network. Appl Intell. 2019;49(8):3016–3026. doi: 10.1007/s10489-019-01433-4.

Wang W, Zhang F, Luo X, Zhang S. PDRCNN: precise phishing detection with recurrent convolutional neural networks. Secur Commun Netw. 2019;2019:2595794. doi: 10.1155/2019/2595794.

Wang L, Tong L, Davis D, Arnold T, Esposito T. The application of unsupervised deep learning in predictive models using electronic health records. BMC Med Res Methodol. 2020;20(1):1–9. doi: 10.1186/s12874-020-00923-1.

Wei X, Wei X, Kong X, Lu S, Xing W, Lu W. FMixCutMatch for semi-supervised deep learning. Neural Netw. 2020;133:166–176. doi: 10.1016/j.neunet.2020.10.018.

Wohlin C (2014) Guidelines for snowballing in systematic literature studies and a replication in software engineering. In: Proceedings of the 18th international conference on evaluation and assessment in software engineering—EASE ’14, 1–10. 10.1145/2601248.2601268

Wong M (2019) Deep learning models for malicious web content detection: an enterprise study (Doctoral dissertation).

Wu Y, Schuster M, Chen Z, Le QV, Norouzi M, Macherey W, Klingner J (2016) Google’s neural machine translation system: bridging the gap between human and machine translation. arXiv preprint arXiv:1609.08144

Xia P, Wang H, Zhang B, Ji R, Gao B, Wu L, Xu G. Characterizing cryptocurrency exchange scams. Comput Secur. 2020;98:101993. doi: 10.1016/j.cose.2020.101993.

Yi P, Guan Y, Zou F, Yao Y, Wang W, Zhu T. Web phishing detection using a deep learning framework. Wirel Commun Mobile Comput. 2018;2018:4678746. doi: 10.1155/2018/4678746.

Yu D, Deng L. Deep learning and its applications to signal and information processing [exploratory dsp] IEEE Signal Process Mag. 2010;28(1):145–154. doi: 10.1109/MSP.2010.939038.

Zamir A, Khan HU, Iqbal T, Yousaf N, Aslam F, Anjum A, Hamdani M. Phishing web site detection using diverse machine learning algorithms. Electron Libr. 2020;38(1):65–80. doi: 10.1108/EL-05-2019-0118.

Zhang Y, Wang J, Chen B. Detecting false data injection attacks in smart grids: a semi-supervised deep learning approach. IEEE Trans Smart Grid. 2020;12:623–634. doi: 10.1109/TSG.2020.3010510.

Zuraiq AA, Alkasassbeh M (2019) Phishing detection approaches. In: 2019 2nd international conference on new trends in computing sciences (ICTCS). IEEE, pp 1–6",No grants available
