PMID,Title,Abstract,Journal,Authors,Publication Date,DOI,PMC ID,URL,References,Grants
40567680,Enhancing phishing detection with dynamic optimization and character-level deep learning in cloud environments.,"As cloud computing becomes increasingly prevalent, the detection and prevention of phishing URL attacks are essential, particularly in the Internet of Vehicles (IoV) environment, to maintain service reliability. In such a scenario, an attacker could send misleading phishing links, potentially compromising the system's functionality or, at worst, leading to a complete shutdown. To address these emerging threats, this study introduces a novel Dynamic Arithmetic Optimization Algorithm with Deep Learning-Driven Phishing URL Classification (DAOA-DLPC) model for cloud-enabled IoV infrastructure. The candidate's research utilizes character-level embeddings instead of word embeddings, as the former can capture intricate URL patterns more effectively. These embeddings are integrated with a deep learning model, the Multi-Head Attention and Bidirectional Gated Recurrent Units (MHA-BiGRU). To improve precision, hyperparameter tuning has been done using DAOA. The proposed method offers a feasible solution for identifying the phishing URLs, and the method achieves computational efficiency through the attention mechanism and dynamic hyperparameter optimization. The need for this work comes from the observation that the traditional machine learning approaches are not effective in dynamic environments like phishing threat landscapes in a dynamic environment such as the one of phishing threats. The presented DLPC approach is capable of learning new forms of phishing attacks in real time and reduce false positives. The experimental results show that the proposed DAOA-DLPC model outperforms the other models with an accuracy of 98.85%, recall of 98.49%, and F1-score of 98.38% and can effectively detect safe and phishing URLs in dynamic environments. These results imply that the proposed model is useful in distinguishing between safe and unsafe URLs than the conventional models.",PeerJ. Computer science,"Ravula, Ramaiah",2025,10.7717/peerj-cs.2640,PMC12190431,https://pubmed.ncbi.nlm.nih.gov/40567680,"Akande TO, Alabi OO, Ajagbe SA. A deep learning-based CAE approach for simulating 3D vehicle wheels under real-world conditions. Artificial Intelligence and Applications.2022.

Alani MM, Tawfik H. Phishnot: a cloud-based machine-learning approach to phishing URL detection. Computer Networks. 2022;218(4):109407. doi: 10.1016/j.comnet.2022.109407.

Alohali MA, Alasmari N, Maashi M, Nouri AM, Rizwanullah M, Yaseen I, Osman AE, Alneil AA. Metaheuristics with deep learning driven phishing detection for sustainable and secure environment. Sustainable Energy Technologies and Assessments. 2023;56:103114. doi: 10.1016/j.seta.2023.103114.

Alsaedi M, Ghaleb FA, Saeed F, Ahmad J, Alasli M. Cyber threat intelligence-based malicious url detection model using ensemble learning. Sensors. 2022;22(9):3373. doi: 10.3390/s22093373.

Al-Sarem M, Saeed F, Al-Mekhlafi ZG, Mohammed BA, Al-Hadhrami T, Alshammari MT, Alreshidi A, Alshammari TS. An optimized stacking ensemble model for phishing websites detection. Electronics. 2021;10(11):1285. doi: 10.3390/electronics10111285.

Alshehri M, Abugabah A, Algarni A, Almotairi S. Character-level word encoding deep learning model for combating cyber threats in phishing URL detection. Computers and Electrical Engineering. 2022;100(2):107868. doi: 10.1016/j.compeleceng.2022.107868.

Alshingiti Z, Alaqel R, Al-Muhtadi J, Haq QEU, Saleem K, Faheem MH. A deep learning-based phishing detection system using CNN, LSTM, and lSTM-CNN. Electronics. 2023;12(1):232. doi: 10.3390/electronics12010232.

Alsubaei FS, Almazroi AA, Ayub N. Enhancing phishing detection: a novel hybrid ndeep learning framework for cybercrime forensics. IEEE Access. 2024;12:8373. doi: 10.1109/ACCESS.2024.3351946.

Aslam S, Aslam H, Manzoor A, Chen H, Rasool A. Antiphishstack: LSTM-based stacked generalization model for optimized phishing URL detection. Symmetry. 2024;16(2):248. doi: 10.3390/sym16020248.

Bahaghighat M, Ghasemi M, Ozen F. A high-accuracy phishing website detection method based on machine learning. Journal of Information Security and Applications. 2023;77(2):103553. doi: 10.1016/j.jisa.2023.103553.

Bhosle K, Musande V. Evaluation of deep learning CNN model for recognition of devanagari digit. Artificial Intelligence and Applications. 2023;1(2):114–118. doi: 10.47852/bonviewAIA3202441.

Chen H, Ru J, Long H, He J, Chen T, Deng W. Semi-supervised adaptive pseudo-label feature learning for hyperspectral image classification in Internet of Things. IEEE Internet of Things Journal. 2024;11:30754. doi: 10.1109/JIOT.2024.3412925.

Deng W, Cai X, Wu D, Song Y, Chen H, Ran X, Zhou X, Zhao H. MOQEA/D: multi-objective QEA with decomposition mechanism and excellent global search and its application. IEEE Transactions on Intelligent Transportation Systems. 2024;25(9):12517–12527. doi: 10.1109/TITS.2024.3373510.

Dutta AK, Meyyappan T, Qureshi B, Alsanea M, Abulfaraj AW, Al Faraj M, Sait ARW. Optimal deep belief network enabled cybersecurity phishing email classification. Computer Systems Science & Engineering. 2023;44(3):2701–2713. doi: 10.32604/csse.2023.028984.

Ejaz A, Mian AN, Manzoor S. Life-long phishing attack detection using continual learning. Scientific Reports. 2023;13(1):11488. doi: 10.1038/s41598-023-37552-9.

Elumalai K, Bose D. Advancement of phishing attack detection using machine learning. Journal of Electrical Systems. 2024;20(10s):1208–1213.

Ige T, Kiekintveld C, Piplai A. Deep learning-based speech and vision synthesis to improve phishing attack detection through a multi-layer adaptive framework. 2024. ArXiv preprint.

Jafari S, Aghaee-Maybodi N. Detection of phishing addresses and pages with a data set balancing approach by generative adversarial network (GAN) and convolutional neural network (CNN) optimized with swarm intelligence. Concurrency and Computation: Practice and Experience. 2024;36:8033. doi: 10.1002/cpe.8033.

Jha B, Atre M, Rao A. Detecting cloud-based phishing attacks by combining deep learning models. 2022 IEEE 4th International Conference on Trust, Privacy and Security in Intelligent Systems, and Applications (TPS-ISA); Piscataway: IEEE; 2022. pp. 130–139.

Lavanya B, Shanthi C. Malicious software detection based on URL-API intensity feature selection using deep spectral neural classification for improving host security. International Journal of Computational Intelligence and Applications. 2023;22(2):2350002. doi: 10.1142/S1469026823500025.

Li F, Chen J, Zhou L, Kujala P. Investigation of ice wedge bearing capacity based on an anisotropic beam analogy. Ocean Engineering. 2024;302(2129):117611. doi: 10.1016/j.oceaneng.2024.117611.

Li X, Ding L, Du Y, Fan Y, Shen F. Position-enhanced multi-head self-attention based bidirectional gated recurrent unit for aspect-level sentiment classification. Frontiers in Psychology. 2022;385(12):799926. doi: 10.3389/fpsyg.2021.799926.

Li W, Liu D, Li Y, Hou M, Liu J, Zhao Z, Guo A, Zhao H, Deng W. Fault diagnosis using variational autoencoder GAN and focal loss CNN under unbalanced data. Structural Health Monitoring. 2024;55(11):60. doi: 10.1177/14759217241254121.

Meng Y, Chang C, Huo J, Zhang Y, Mohammed Al-Neshmi HM, Xu J, Xie T. Research on ultra-short-term prediction model of wind power based on attention mechanism and CNN-BiGRU combined. Frontiers in Energy Research. 2022;10:920835. doi: 10.3389/fenrg.2022.920835.

Ozcan A, Catal C, Donmez E, Senturk B. A hybrid DNN-LSTM model for detecting phishing URLs. Neural Computing and Applications. 2023;35(7):1–17. doi: 10.1007/s00521-021-06401-z.

Patgiri R, Biswas A, Nayak S. deepBF: malicious URL detection using learned bloom filter and evolutionary deep learning. Computer Communications. 2023;200(7):30–41. doi: 10.1016/j.comcom.2022.12.027.

Prabakaran MK, Meenakshi Sundaram P, Chandrasekar AD. An enhanced deep learning-based phishing detection mechanism to effectively identify malicious URLs using variational autoencoders. IET Information Security. 2023;17(3):423–440. doi: 10.1049/ise2.12106.

Prasad A, Chandra S. Phiusiil: a diverse security profile empowered phishing URL detection framework based on similarity index and incremental learning. Computers & Security. 2024;136(4):103545. doi: 10.1016/j.cose.2023.103545.

Preethi P, Mamatha HR. Region-based convolutional neural network for segmenting text in epigraphical images. Artificial Intelligence and Applications. 2023;1(2):119–127. doi: 10.47852/bonviewAIA2202293.

Ramaiah M, Chandrasekaran V, Chand V, Vasudevan A, Ibrahim S. Enhanced phishing detection: an ensemble stacking model with DT-RFECV and SMOTE. Applied Mathematics. 2024;18(6):1481–1493. doi: 10.18576/amis/180624.

Ramaiah M, Chandrasekaran V, Ravi V, Kumar N. An intrusion detection system using optimized deep neural network architecture. Transactions on Emerging Telecommunications Technologies. 2021;32(4):e4221. doi: 10.1002/ett.4221.

Sahingoz OK, Buber E, Kugu E. Dephides: deep learning based phishing detection system. IEEE Access. 2024;12:8052. doi: 10.1109/ACCESS.2024.3352629.

Said Y, Alsheikhy AA, Lahza H, Shawly T. Detecting phishing websites through improving convolutional neural networks with Self-Attention mechanism. Ain Shams Engineering Journal. 2024;15(4):102643. doi: 10.1016/j.asej.2024.102643.

Shombot ES, Dusserre G, Bestak R, Ahmed NB. An application for predicting phishing attacks: a case of implementing a support vector machine learning model. Cyber Security and Applications. 2024;2(4):100036. doi: 10.1016/j.csa.2024.100036.

Subashini K, Narmatha V. Deep learning empowered phishing URL detection: an exhaustive approach. International Journal of Intelligent Systems and Applications in Engineering. 2024;12(14s):213–222.

Subhashini N, Banerjee A, Kumar A, Muthulakshmi S, Revathi S. Deep learning based phishing website detection. Telkomnika (Telecommunication Computing Electronics and Control) 2024;22(1):113–121. doi: 10.12928/telkomnika.v22i1.25516.

Ullah A, Shah RA, Nawaz SA, Ahmad N, Malik MH. Journal of Computing & Biomedical Informatics, Special Issue on Artificial Intelligence and Emerging Technologies (SICAIET) 2024. Enhancing phishing detection, leveraging deep learning techniques.

Zhao H, Gao Y, Deng W. Defect detection using shuffle Net-CA-SSD lightweight network for turbine blades in IoT. IEEE Internet of Things Journal. 2024;11(20):32804–32812. doi: 10.1109/JIOT.2024.3409823.",No grants available
40108268,Explainable TabNet ensemble model for identification of obfuscated URLs with features selection to ensure secure web browsing.,"Obfuscated and malicious URLs may lead to harmful content or actions to the system, such as downloading malware, phishing, scams, or adware. In the domain of cybersecurity, the identification of the obfuscated Uniform Resource Locator (URL) is a concerning facet. This study proposes a Robust unified TabNet ensemble model for the identification of Malicious URLs with feature extraction based on the computation of features' importance for classification. A fine-tuned attention-based deep neural network TabNet is used to extract the features of the URL. The customized data with the most important features is generated, and a Machine Learning (ML) ensemble model is developed for the classification of the URLs. The evaluation parameters accuracy, Precision, Recall, and F1-score are measured to look at the performance of the TabNet ensemble model. Accuracy of 97.8%, precision of 0.978, recall of 0.976, and F1-score of 0.978 reflect the outperforming results of the proposed model while classifying the five URL classes. The model is further validated through statistical analysis by measuring the Kappa value, which comes up as 0.968 for the proposed model. With a 10-fold cross-validation model, we attained a mean accuracy of 97.27% and a confidence interval of 0.004. The Local Interpretable Model-agnostic Explanations (LIME) explainable AI model is used to validate the model to perceive the contributing features towards the classification model. The results are compared with the state-of-the-art ML classifiers and the previous studies, and the whole validation process favors the proposed model's efficacy.",Scientific reports,"Naseer, Ullah, Saeed, Algarni, Zhao",2025,10.1038/s41598-025-93286-w,PMC11923084,https://pubmed.ncbi.nlm.nih.gov/40108268,"Rafsanjani, A. S. et al. Enhancing malicious url detection: A novel framework leveraging priority coefficient and feature evaluation. IEEE Access (2024).

Mankar, N. P. et al. Comparative evaluation of machine learning models for malicious url detection. In 2024 MIT Art, Design and Technology School of Computing International Conference (MITADTSoCiCon), 1–7 (IEEE, 2024).

Hani, R. B., Amoura, M., Ammourah, M., Khalil, Y. A. & Swailm, M. Malicious url detection using machine learning. In 2024 15th International Conference on Information and Communication Systems (ICICS), 1–5 (IEEE, 2024).

Orozco-Fonseca, D., Marín, G. & Lara, A. Taxonomy of malicious url detection techniques. In International Conference on Information Technology & Systems, 73–81 (Springer, 2024).

Zieni, R., Massari, L. & Calzarossa, M. C. Phishing or not phishing? a survey on the detection of phishing websites. IEEE Access11, 18499–18519 (2023).

Aljahdalic, A. O., Banafee, S. & Aljohani, T. Url filtering using machine learning algorithms. Information Security Journal: A Global Perspective33, 193–203 (2024).

Maftoun, M., Shadkam, N., Komamardakhi, S. S. S., Mansor, Z. & Joloudari, J. H. Malicious url detection using optimized hist gradient boosting classifier based on grid search method. arXiv preprintarXiv:2406.10286 (2024).

Opara, C., Chen, Y. & Wei, B. Look before you leap: Detecting phishing web pages by exploiting raw url and html characteristics. Expert Systems with Applications236, 121183 (2024).

Salman, R., Alzaatreh, A. & Sulieman, H. The stability of different aggregation techniques in ensemble feature selection. Journal of Big Data9, 51 (2022).

Arora, R., Gupta, R. & Yadav, P. Utilizing ensemble learning to enhance the detection of malicious urls in the twitter dataset. In 2024 4th International Conference on Innovative Practices in Technology and Management (ICIPTM), 1–6 (IEEE, 2024).

Mills, G. A., Acquah, D. K. & Sowah, R. A. Network intrusion detection and prevention system using hybrid machine learning with supervised ensemble stacking model. Journal of Computer Networks and Communications2024, 5775671 (2024).

Dieber, J. & Kirrane, S. Why model why? assessing the strengths and limitations of lime. arXiv preprintarXiv:2012.00093 (2020).

Van den Broeck, G., Lykov, A., Schleich, M. & Suciu, D. On the tractability of shap explanations. Journal of Artificial Intelligence Research74, 851–886 (2022).

Dharmaraju, G., Kumar, T. N., Mohan, P. P., Pbv, R. R. & Lakshmanarao, A. Phishing website detection through ensemble machine learning techniques. In 2024 2nd International Conference on Computer, Communication and Control (IC4), 1–5 (IEEE, 2024).

Newaz, A., Haq, F. S. & Ahmed, N. A sophisticated framework for the accurate detection of phishing websites. arXiv preprintarXiv:2403.09735 (2024).

de Luna, R. G. et al. Improving cybersecurity: A comparative analysis of machine learning-based uniform resource locator (url) classification. In 2024 7th International Conference on Informatics and Computational Sciences (ICICoS), 78–83 (IEEE, 2024).

Wabi, H. A., Ojeniyi, J. A., Idris, I. & Subairu, S. O. Stack ensemble model for detection of phishing website. In 2024 International Conference on Science, Engineering and Business for Driving Sustainable Development Goals (SEB4SDG), 1–6 (IEEE, 2024).

Guo, J. et al. Tfl-dt: A trust evaluation scheme for federated learning in digital twin for mobile networks. IEEE Journal on Selected Areas in Communications (2023).

Kaushal, V. & Sharma, S. Fairness-driven federated learning-based spam email detection using clustering techniques. Neural Computing and Applications 1–12 (2025).

Adamova, A., Zhukabayeva, T., Mukanova, Z. & Oralbekova, Z. Enhancing internet of things security against structured query language injection and brute force attacks through federated learning. International Journal of Electrical & Computer Engineering (2088-8708)15 (2025).

Poddar, S., Chowdhury, D., Dwivedi, A. D. & Mukkamala, R. R. Data driven based malicious url detection using explainable ai. In 2022 IEEE International Conference on Trust, Security and Privacy in Computing and Communications (TrustCom), 1266–1272 (IEEE, 2022).

Pavani, B. V., Mahitha, D. & Maheswari, B. U. Enhancing online safety: Phishing url detection using machine learning and explainable ai. In 2024 15th International Conference on Computing Communication and Networking Technologies (ICCCNT), 1–6 (IEEE, 2024).

Calzarossa, M. C., Giudici, P. & Zieni, R. Explainable machine learning for phishing feature detection. Quality and Reliability Engineering International40, 362–373 (2024).

Mittal, S. Explaining url phishing detection by glass box models. In Proceedings of the 2023 Fifteenth International Conference on Contemporary Computing, 537–544 (2023).

Giri, S. & Banerjee, S. Ensemble learning approach for phishing website detection using an optimal greedy stacking model. Journal of The Institution of Engineers (India): Series B 1–10 (2024).

Lee, D. K., In, J. & Lee, S. Standard deviation and standard error of the mean. Korean journal of anesthesiology68, 220–223 (2015).

Patro, S. Normalization: A preprocessing stage. arXiv preprintarXiv:1503.06462 (2015).

Arik, S. Ö. & Pfister, T. Tabnet: Attentive interpretable tabular learning. In Proceedings of the AAAI conference on artificial intelligence35, 6679–6687 (2021).

Talib, M. A. et al. A tree-based explainable ai model for early detection of covid-19 using physiological data. BMC Medical Informatics and Decision Making24, 179 (2024).

De Ville, B. Decision trees. Wiley Interdisciplinary Reviews: Computational Statistics5, 448–455 (2013).

Shwartz-Ziv, R. & Armon, A. Tabular data: Deep learning is not all you need. Information Fusion81, 84–90 (2022).

Lee, Y., Baruzzo, G., Kim, J., Seo, J. & Di Camillo, B. Validity of feature importance in low-performing machine learning for tabular biomedical data. arXiv preprintarXiv:2409.13342 (2024).

Zhang, Z. Improved adam optimizer for deep neural networks. In 2018 IEEE/ACM 26th international symposium on quality of service (IWQoS), 1–2 (Ieee, 2018).

Li, Z. & Arora, S. An exponential learning rate schedule for deep learning. arXiv preprintarXiv:1910.07454 (2019).

Abro, A. A., Khan, A. A., Talpur, M. S. H., Kayijuka, I. & Yaşar, E. Machine learning classifiers: a brief primer. University of Sindh Journal of Information and Communication Technology5, 63–68 (2021).

Sesmero, M. P., Ledezma, A. I. & Sanchis, A. Generating ensembles of heterogeneous classifiers using stacked generalization. Wiley interdisciplinary reviews: data mining and knowledge discovery5, 21–34 (2015).

Chaudhary, A., Kolhe, S. & Kamal, R. An improved random forest classifier for multi-class classification. Information Processing in Agriculture3, 215–222 (2016).

Nick, T. G. & Campbell, K. M. Logistic regression. Topics in biostatistics 273–301 (2007).

Suthaharan, S. & Suthaharan, S. Support vector machine. Machine learning models and algorithms for big data classification: thinking with examples for effective learning 207–235 (2016).

Intelligence, E. A., Rosa1, L. & Silva1, F. Check for. In Distributed Computing and Artificial Intelligence, Special Sessions, 19th International Conference, vol. 585, 93 (Springer Nature, 2023).

Vieira, S. M., Kaymak, U. & Sousa, J. M. Cohen’s kappa coefficient as a performance measure for feature selection. In International conference on fuzzy systems, 1–8 (IEEE, 2010).

Hsu, L. M. & Field, R. Interrater agreement measures: Comments on kappan, cohen’s kappa, scott’s [Image: see text] , and aickin’s [Image: see text]. Understanding Statistics2, 205–219 (2003).

Mamun, M. S. I., Rathore, M. A., Lashkari, A. H., Stakhanova, N. & Ghorbani, A. A. Detecting malicious urls using lexical analysis. In Network and System Security: 10th International Conference, NSS 2016, Taipei, Taiwan, September 28-30, 2016, Proceedings 10, 467–482 (Springer, 2016).

Sankaranarayanan, S., Sivachandran, A. T., Mohd Khairuddin, A. S., Hasikin, K. & Wahab Sait, A. R. An ensemble classification method based on machine learning models for malicious uniform resource locators (url). Plos one19, e0302196 (2024).

Aslam, S., Aslam, H., Manzoor, A., Chen, H. & Rasool, A. Antiphishstack: Lstm-based stacked generalization model for optimized phishing url detection. Symmetry16, 248 (2024).

Alsaffar, A. M., Nouri-Baygi, M. & Zolbanin, H. M. Shielding networks: enhancing intrusion detection with hybrid feature selection and stack ensemble learning. Journal of Big Data11, 133 (2024).

Mushtaq, S., Javed, T. & Su’ud, M. M. Ensemble learning-powered url phishing detection: A performance driven approach. Journal of Informatics and Web Engineering3, 134–145 (2024).

Yu, B. et al. Efficient classification of malicious urls: M-bert-a modified bert variant for enhanced semantic understanding. IEEE Access (2024).",No grants available
