PMID,Title,Abstract,Journal,Authors,Publication Date,DOI,PMC ID,URL,References,Grants
37765815,Classification of Malicious URLs Using Machine Learning.,"Amid the rapid proliferation of thousands of new websites daily, distinguishing safe ones from potentially harmful ones has become an increasingly complex task. These websites often collect user data, and, without adequate cybersecurity measures such as the efficient detection and classification of malicious URLs, users' sensitive information could be compromised. This study aims to develop models based on machine learning algorithms for the efficient identification and classification of malicious URLs, contributing to enhanced cybersecurity. Within this context, this study leverages support vector machines (SVMs), random forests (RFs), decision trees (DTs), and k-nearest neighbors (KNNs) in combination with Bayesian optimization to accurately classify URLs. To improve computational efficiency, instance selection methods are employed, including data reduction based on locality-sensitive hashing (DRLSH), border point extraction based on locality-sensitive hashing (BPLSH), and random selection. The results show the effectiveness of RFs in delivering high precision, recall, and F1 scores, with SVMs also providing competitive performance at the expense of increased training time. The results also emphasize the substantial impact of the instance selection method on the performance of these models, indicating its significance in the machine learning pipeline for malicious URL classification.","Sensors (Basel, Switzerland)","Abad, Gholamy, Aslani",2023,10.3390/s23187760,PMC10537824,https://pubmed.ncbi.nlm.nih.gov/37765815,"Gupta B.B., Yadav K., Razzak I., Psannis K., Castiglione A., Chang X. A Novel Approach for Phishing URLs Detection Using Lexical Based Machine Learning in a Real-Time Environment. Comput. Commun. 2021;175:47–57. doi: 10.1016/j.comcom.2021.04.023.

Veale M., Brown I. Cybersecurity. Internet Policy Rev. 2020;9:2. doi: 10.14763/2020.4.1533.

Ahammad S.H., Kale S.D., Upadhye G.D., Pande S.D., Babu E.V., Dhumane A.V., Bahadur M.D.K.J. Phishing URL Detection Using Machine Learning Methods. Adv. Eng. Softw. 2022;173:103288. doi: 10.1016/j.advengsoft.2022.103288.

Wardman B., Clemens D., Wolnski J., Inc-San Jose P., States U., States S.D.-U. Phorecasting Phishing Attacks: A New Approach for Predicting the Appearance of Phishing Websites. Cyber-Secur. Digit. 2016;142:142–154. doi: 10.17781/P002156.

Virvilis N., Mylonas A., Tsalis N., Gritzalis D. Security Busters: Web Browser Security vs. Rogue Sites. Comput. Secur. 2015;52:90–105. doi: 10.1016/j.cose.2015.04.009.

Sahoo D., Liu C., Hoi S.C.H. Malicious URL Detection Using Machine Learning: A Survey. arXiv. 20191701.07179

Singh A., Thakur N., Sharma A. A Review of Supervised Machine Learning Algorithms; Proceedings of the 2016 3rd International Conference on Computing for Sustainable Global Development (INDIACom); New Delhi, India. 16–18 March 2016; pp. 1310–1315.

Aslani M., Seipel S. A Fast Instance Selection Method for Support Vector Machines in Building Extraction. Appl. Soft Comput. 2020;97:106716. doi: 10.1016/j.asoc.2020.106716.

Aslani M., Seipel S. Efficient and Decision Boundary Aware Instance Selection for Support Vector Machines. Inf. Sci. 2021;577:579–598. doi: 10.1016/j.ins.2021.07.015.

Li Y., Yang Z., Chen X., Yuan H., Liu W. A Stacking Model Using URL and HTML Features for Phishing Webpage Detection. Future Gener. Comput. Syst. 2019;94:27–39. doi: 10.1016/j.future.2018.11.004.

Saleem Raja A., Vinodini R., Kavitha A. Lexical Features Based Malicious URL Detection Using Machine Learning Techniques. Mater. Today Proc. 2021;47:163–166. doi: 10.1016/j.matpr.2021.04.041.

Habib_Mrad-Detection Malicious URL Using ML Models.  [(accessed on 7 April 2023)].  Available online:  https://kaggle.com/code/habibmrad1983/habib-mrad-detection-malicious-url-using-ml-models.

Aljabri M., Alhaidari F., Mohammad R.M.A., Mirza S., Alhamed D.H., Altamimi H.S., Chrouf S.M.B. An Assessment of Lexical, Network, and Content-Based Features for Detecting Malicious URLs Using Machine Learning and Deep Learning Models. Comput. Intell. Neurosci. 2022;2022:3241216. doi: 10.1155/2022/3241216.

Upendra Shetty D.R., Patil A., Mohana Malicious URL Detection and Classification Analysis Using Machine Learning Models; Proceedings of the 2023 International Conference on Intelligent Data Communication Technologies and Internet of Things (IDCIoT); Bengaluru, India. 5–7 January 2023; pp. 470–476.

Sharma H., Kumar S. A Survey on Decision Tree Algorithms of Classification in Data Mining. Int. J. Sci. Res. 2016;5:2094–2097.

Alam M.S., Vuong S.T. Random Forest Classification for Detecting Android Malware; Proceedings of the 2013 IEEE International Conference on Green Computing and Communications and IEEE Internet of Things and IEEE Cyber, Physical and Social Computing; Washington, DC, USA. 20–23 August 2013; pp. 663–669.

Cortes C., Vapnik V. Support-Vector Networks. Mach. Learn. 1995;20:273–297. doi: 10.1007/BF00994018.

Adeyemi A., Mosavi A. Domain Driven Data Mining—Application to Business. Int. J. Comput. Sci. Issues. 2010;7:41–44.

Hutter F., Kotthoff L., Vanschoren J., editors. Automated Machine Learning: Methods, Systems, Challenges. Springer International Publishing; Cham, Switzerland: 2019. (The Springer Series on Challenges in Machine Learning).

Wang S., Yu J., Lapira E., Lee J. A Modified Support Vector Data Description Based Novelty Detection Approach for Machinery Components. Appl. Soft Comput. 2013;13:1193–1205. doi: 10.1016/j.asoc.2012.11.005.

Shahriari B., Swersky K., Wang Z., Adams R.P., de Freitas N. Taking the Human Out of the Loop: A Review of Bayesian Optimization. Proc. IEEE. 2016;104:148–175. doi: 10.1109/JPROC.2015.2494218.

Ding C., Peng H. Minimum Redundancy Feature Selection from Microarray Gene Expression Data. J. Bioinform. Comput. Biol. 2005;3:185–205. doi: 10.1142/S0219720005001004.",No grants available
37362563,An intelligent identification and classification system for malicious uniform resource locators (URLs).,"Uniform Resource Locator (URL) is a unique identifier composed of protocol and domain name used to locate and retrieve a resource on the Internet. Like any Internet service, URLs (also called websites) are vulnerable to compromise by attackers to develop Malicious URLs that can exploit/devastate the user's information and resources. Malicious URLs are usually designed with the intention of promoting cyber-attacks such as spam, phishing, malware, and defacement. These websites usually require action on the user's side and can reach users across emails, text messages, pop-ups, or devious advertisements. They have a potential impact that can reach, in some cases, to compromise the machine or network of the user, especially those arriving by email. Therefore, developing systems to detect malicious URLs is of great interest nowadays. This paper proposes a high-performance machine learning-based detection system to identify Malicious URLs. The proposed system provides two layers of detection. Firstly, we identify the URLs as either benign or malware using a binary classifier. Secondly, we classify the URL classes based on their feature into five classes: benign, spam, phishing, malware, and defacement. Specifically, we report on four ensemble learning approaches, viz. the ensemble of bagging trees (En_Bag) approach, the ensemble of k-nearest neighbor (En_kNN) approach, and the ensemble of boosted decision trees (En_Bos) approach, and the ensemble of subspace discriminator (En_Dsc) approach. The developed approaches have been evaluated on an inclusive and contemporary dataset for uniform resource locators (ISCX-URL2016). ISCX-URL2016 provides a lightweight dataset for detecting and categorizing malicious URLs according to their attack type and lexical analysis. Conventional machine learning evaluation measurements are used to evaluate the detection accuracy, precision, recall, F Score, and detection time. Our experiential assessment indicates that the ensemble of bagging trees (En_Bag) approach provides better performance rates than other ensemble methods. Alternatively, the ensemble of the k-nearest neighbor (En_kNN) approach provides the highest inference speed. We also contrast our En_Bag model with state-of-the-art solutions and show its superiority in binary classification and multi-classification with accuracy rates of 99.3% and 97.92%, respectively.",Neural computing & applications,"Abu Al-Haija, Al-Fayoumi",2023,10.1007/s00521-023-08592-z,PMC10117275,https://pubmed.ncbi.nlm.nih.gov/37362563,"Key Internet Statistics to Know in (2022) (Including Mobile) - BroadbandSearch.” [Online]. Available: https://www.broadbandsearch.net/blog/internet-statistics. Accessed: 04-Aug-2022.

Reports PE, Trends PS, Measurement BP, Attacks, Targeted M, Sectors I, Quarter, (2022) [Online]. Available: https://docs.apwg.org/reports/apwg_trends_report_q1_2022.pdf. Accessed: 23-Jun-2022.

Saleem Raja A, Vinodini R, Kavitha A. Lexical features based malicious URL detection using machine learning techniques. Mater Today: Proceed. 2021;47:163–166.

Al-Fayoumi M, Alwidian J, Abusaif M, East IM. Intelligent Association Classification Technique for Phishing Website Detection. Int Arab J Inform Technol. 2020;17(4):163. doi: 10.34028/iajit/17/4/7.

Haynes K, Shirazi H, Ray I. Lightweight URL-based phishing detection using natural language processing transformers for mobile devices. Procedia Computer Science. 2021;191:127–134. doi: 10.1016/j.procs.2021.07.040.

R. Abdulraheem, A. Odeh, M. Al Fayoumi and I. Keshta, ""Efficient Email phishing detection using Machine learning,"" 2022 IEEE 12th Annual Computing and Communication Workshop and Conference (CCWC), Las Vegas, NV, USA, 2022, pp. 0354–0358. 10.1109/CCWC54503.2022.9720818

Yaseen YA, Qasaimeh M, Al-Qassas RS, Al-Fayoumi M. E-mail fraud attack detection using hybrid machine learning approach. Recent Adv Comput Sci Commun. 2021;14(5):1370–1380. doi: 10.2174/2213275912666190617162707.

Zahra SR, Chishti MA, Baba AI, Wu F. Detecting covid-19 chaos driven phishing/malicious URL attacks by a fuzzy logic and data mining based intelligence system. Egyptian Inform J. 2022;23(2):197–214. doi: 10.1016/j.eij.2021.12.003.

Sayamber AB, Dixit AM. Malicious URL detection and identification. Int J Comput Appl. 2014;99(17):17–23.

Ibrahim DR and Hadi AH (2017) Phishing websites prediction using classification techniques, in: Proceedings - 2017 International conference on new trends in computing sciences, ICTCS 2017, 2018-Janua, 133–137

Subasi A, Molah E, Almkallawi F, Chaudhery TJ (2017) Intelligent phishing website detection using random forest classifier,I n: 2017 International conference on electrical and computing technologies and applications, ICECTA 2017, 2018-Janua, pp. 1–5,

Peng T, Harris I, Sawa Y (2018) Detecting phishing attacks using natural language processing and machine learning, in: Proceedings - 12th IEEE international conference on semantic computing, ICSC 2018, 2018-Janua, pp. 300–301

Patil V, Thakkar P, Shah C, Bhat T, Godse SP (2018) Detection and prevention of phishing websites using machine learning Approach,in: Proceedings - 2018 4th international conference on computing, communication control and automation, ICCUBEA 2018, pp. 2–6

Patil D, Patil J. Feature-based malicious url and attack type detection using multi-class classification. The ISC Int J Inform Secur. 2018;10(2):141–162.

Adebowale MA, Lwin KT, Sánchez E, Hossain MA. Intelligent web-phishing detection and protection scheme using integrated features of Images, frames and text. Expert Syst Appl. 2019;115:300–313. doi: 10.1016/j.eswa.2018.07.067.

Yi P, Guan Y, Zou F, Yao Y, Wang W, Zhu T. Web phishing detection using a deep learning framework. Wireless Commun Mobile Comput. 2018 doi: 10.1155/2018/4678746.

Zamir A, et al. Phishing web site detection using diverse machine learning algorithms. Electronic Library. 2020;38(1):65–80. doi: 10.1108/EL-05-2019-0118.

Sahingoz OK, Buber E, Demir O, Diri B. Machine learning based phishing detection from URLs. Expert Syst Appl. 2019;117:345–357. doi: 10.1016/j.eswa.2018.09.029.

Varaprasada Rao P, Govinda Rao S, Chandrasekhar Reddy P, Anil Kumar BS, Anil Kumar G. Detection of malicious uniform resource locator. Int J Recent Technol Eng. 2019;8:41–47.

Dsouza, Rohan. Malicious URL (s) classification. Diss. Dublin, National College of Ireland, 2020. https://norma.ncirl.ie/4138/1/rohandsouza.pdf

Saha I, Sarma D, Chakma RJ, Alam MN, Sultana A, Hossain S (2020) Phishing attacks detection using deep learning approach,in: Proceedings of the 3rd international conference on smart systems and inventive technology, ICSSIT 2020, Icssit, pp. 1180–1185

Odeh A, Keshta I, Abdelfattah E. Efficient detection of phishing websites using multilayer perceptron. Int J Interact Mobile Technol. 2020;14(11):22–31. doi: 10.3991/ijim.v14i11.13903.

Barlow L, Bendiab G, Shiaeles S, Savage N(2020) A novel approach to detect phishing attacks using binary visualisation and machine learning,in: proceedings - 2020 IEEE world congress on services, SERVICES 2020, pp. 177–182

Xiao X, Zhang D, Hu G, Jiang Y, Xia S. CNN–MHSA: a convolutional neural network and multi-head self-attention combined approach for detecting phishing websites. Neural Netw. 2020;125:303–312. doi: 10.1016/j.neunet.2020.02.013.

Shirazi H, Muramudalige SR, Ray I, and Jayasumana AP (2020) Improved Phishing Detection Algorithms using Adversarial Autoencoder Synthesized Data, in: proceedings - conference on local computer networks, LCN, vol. 2020-Novem, pp. 24–32

Al-Haija QA, Badawi AA. URL-based phishing websites detection via machine learning. Int Conf Data Anal Business Ind (ICDABI) 2021;2021:644–649. doi: 10.1109/ICDABI53623.2021.9655851.

Maini A, Kakwani N, Ranjitha B, Shreya MK, Bharathi R (2021) Improving the performance of semantic-based phishing detection system through ensemble learning method,in: 2021 IEEE Mysore Sub Section international conference, MysuruCon 2021, pp. 463–469

Wang Z, Ren X, Li S, Wang B, Zhang J, Yang T. A malicious URL detection model based on convolutional neural network. Secur Netw. 2021 doi: 10.1155/2021/5518528.

Manoj P, Bhuvan Kumar Y, Rakshitha D, Megha G. Detection and classification of phishing websites. Trends Comput Sci Inform Technol. 2021;6:053–059. doi: 10.17352/tcsit.000040.

Abdulraheem R, Odeh A, Al Fayoumi M, Keshta I (2022) Efficient e-mail phishing detection using machine learning,in: 2022 IEEE 12th annual computing and communication workshop and conference, CCWC 2022, pp. 354–358

URL dataset, by Canadian Institute for Cybersecurity (CIC). https://www.unb.ca/cic/datasets/url-2016.html

Al-Haija QA, Gharaibeh M, Odeh A. Detection in adverse weather conditions for autonomous vehicles via deep learning. AI. 2022;3:303–331. doi: 10.3390/ai3020019.

Huang S, Cai N, Pacheco PP, Narrandes S, Wang Y, et al. Applications of support vector machine (SVM) learning in cancer genomics. Cancer Genom - Proteom. 2018;15(1):41–51.

Lubis AR, Lubis M. Optimization of distance formula in k-nearest neighbor method, Bullet Electrical Eng Inform. 2020;9(1):326–338. doi: 10.11591/eei.v9i1.1464.

Abu Al-Haija Q, Al-Saraireh J. Asymmetric identification model for human-robot contacts via supervised learning. Symmetry. 2022;14:591. doi: 10.3390/sym14030591.

Abu Al-Haija Q. Top-down machine learning-based architecture for cyberattacks identification and classification in IoT communication networks. Front Big Data. 2022;4:782902. doi: 10.3389/fdata.2021.782902.

Tsogbaatar E, Bhuyan MH, Taenaka Y, Fall D, Gonchigsumlaa K, Elmroth E, Kadobayashi Y. DeL-IoT: A deep ensemble learning approach to uncover anomalies in IoT. Int Things. 2021;14:10031.

Zidi S, Mihoub A, Qaisar SM, Krichen M, Al-Haija QA. Theft detection dataset for benchmarking and machine learning based classification in a smart grid environment. J King Saud Univ-Comput Inform Sc. 2022;35:13.

Albulayhi K, et al. IoT intrusion detection using machine learning with a novel high performing feature selection method. Appl Sci. 2022;12:5015. doi: 10.3390/app1210501.

Abu Al-Haija Q, Al-Badawi A. Attack-aware IoT network traffic routing leveraging ensemble learning. Sensors. 2022;22:241. doi: 10.3390/s22010241.

Ibrahim DR, Hadi, AH (2017) Phishing websites prediction using classification techniques,in: International Conference on New Trendsin ComputingSciences (ICTCS’17), IEEE, pp.133–137

Subasi A, Molah E, Almkallawi, F and Chaudhery, TJ (2017) Intelligent phishing website detection using random Forest classifier, International conference on electrical and computing technologies and applications (ICECTA ’17), IEEE, pp.1–5

Peng T, Harris I, Sawa Y (2018) Detecting phishing attacks using natural language processing and machine learning,in: 2018 IEEE 12th inter. conference on semantic computing (ICSC), 2018, 300-301, 10.1109/ICSC.2018.00056

Zamir A, Khan HU, Iqbal T, Yousaf N, Aslam F, Anjum A, Hamdani M. Phishing web site detection using diverse machine learning algorithms. Electron Libr. 2019;38(1):65–80. doi: 10.1108/EL-05-2019-0118.

Barlow L, Bendiab G, Shiaeles S, Savage N. A novel approach to detect phishing attacks using binary visualisation and machine learning. IEEE World Congress on Serv (SERVICES) 2020;2020:177–182. doi: 10.1109/SERVICES48979.2020.00046.

Al-Haija QA, McCurry CD, Zein-Sabatto S. A real time node connectivity algorithm for synchronous cyber physical and IoT network systems. SoutheastCon. 2020;2020:1–8. doi: 10.1109/SoutheastCon44009.2020.9249730.

Tyagi S, and Mittal S (2020) Sampling approaches for imbalanced data classification problem in machine learning. Proceedings of ICRIC 2019. Springer, Cham, 2020. 209–221.",No grants available
